{
  "schema_version": "govreplay.agent_action_request.v1",
  "request_id": "req-s3-patch-allow",
  "scenario_id": "S3_patch_proposal",
  "workflow_id": "wf-gateway-s3-patch-allow",
  "run_id": "run-gateway-fixture-001",
  "requested_at": "2026-07-04T16:20:00Z",
  "actor": {
    "actor_id": "govprov:actor:agent-patch-001",
    "actor_type": "agent",
    "roles": ["AGENT_ROLE"]
  },
  "action": {
    "action_id": "action-gateway-S3-0001",
    "action_type": "propose_patch",
    "risk": "medium"
  },
  "resource": {
    "resource_id": "repo:payment-api:patch",
    "resource_type": "GovernedResource",
    "environment": "staging"
  },
  "policy": {
    "bundle_ref": "software-delivery-p3-evidence-strengthened",
    "policy_version": "P3"
  },
  "policy_context": {
    "risk_tier": "medium",
    "evidence_profile": "issue_and_tests",
    "approval_profile": "code_reviewer_distinct",
    "artifact_linkage": "patch_artifact_reference",
    "policy_ref_profile": "bundle_hash_present"
  },
  "evidence_refs": [
    {
      "id": "evidence-gateway-S3-issue",
      "type": "issue",
      "uri": "scenario://S3_patch_proposal/evidence/issue.json"
    },
    {
      "id": "evidence-gateway-S3-tests",
      "type": "test_report",
      "uri": "scenario://S3_patch_proposal/evidence/tests.json"
    }
  ],
  "artifact_refs": [
    {
      "id": "artifact-gateway-S3-patch",
      "type": "source_patch",
      "uri": "scenario://S3_patch_proposal/artifacts/payment-api.patch",
      "digest": {
        "algorithm": "sha256",
        "value": "0x1111111111111111111111111111111111111111111111111111111111111111"
      }
    }
  ],
  "approval_refs": [
    {
      "id": "approval-gateway-S3-review",
      "type": "CODE_REVIEWER",
      "uri": "scenario://S3_patch_proposal/approvals/review.json"
    }
  ],
  "deployment_refs": []
}
