{
  "schema_version": "govreplay.agent_action_request.v1",
  "request_id": "req-s1-runbook-allow",
  "scenario_id": "S1_runbook_update",
  "workflow_id": "wf-gateway-s1-runbook-allow",
  "run_id": "run-gateway-fixture-001",
  "requested_at": "2026-07-04T16:00:00Z",
  "actor": {
    "actor_id": "govprov:actor:agent-runbook-001",
    "actor_type": "agent",
    "roles": ["AGENT_ROLE"]
  },
  "action": {
    "action_id": "action-gateway-S1-0001",
    "action_type": "propose_runbook_update",
    "risk": "low"
  },
  "resource": {
    "resource_id": "runbook:cache-timeout-remediation",
    "resource_type": "GovernedResource",
    "environment": "documentation"
  },
  "policy": {
    "bundle_ref": "software-delivery-p1-baseline",
    "policy_version": "P1"
  },
  "policy_context": {
    "risk_tier": "low",
    "evidence_profile": "baseline",
    "approval_profile": "single_doc_approver",
    "artifact_linkage": "unverified",
    "policy_ref_profile": "bundle_hash_present"
  },
  "evidence_refs": [
    {
      "id": "evidence-gateway-S1-incident",
      "type": "incident_report",
      "uri": "scenario://S1_runbook_update/evidence/incident_report.md"
    }
  ],
  "artifact_refs": [
    {
      "id": "artifact-gateway-S1-runbook",
      "type": "runbook_markdown",
      "uri": "scenario://S1_runbook_update/expected/artifact.md"
    }
  ],
  "approval_refs": [
    {
      "id": "approval-gateway-S1-doc",
      "type": "DOC_APPROVER",
      "uri": "scenario://S1_runbook_update/approvals/doc-approval.json"
    }
  ],
  "deployment_refs": []
}
