{
  "schema_version": "govreplay.agent_action_request.v1",
  "request_id": "req-s2-config-deny",
  "scenario_id": "S2_configuration_change",
  "workflow_id": "wf-gateway-s2-config-deny",
  "run_id": "run-gateway-fixture-001",
  "requested_at": "2026-07-04T16:11:00Z",
  "actor": {
    "actor_id": "govprov:actor:agent-config-001",
    "actor_type": "agent",
    "roles": ["AGENT_ROLE"]
  },
  "action": {
    "action_id": "action-gateway-S2-0002",
    "action_type": "propose_config_change",
    "risk": "high"
  },
  "resource": {
    "resource_id": "service:payment-api:config",
    "resource_type": "GovernedResource",
    "environment": "production"
  },
  "policy": {
    "bundle_ref": "software-delivery-p2-strict-approval",
    "policy_version": "P2"
  },
  "policy_context": {
    "risk_tier": "high",
    "evidence_profile": "config_diff",
    "approval_profile": "self_approved",
    "artifact_linkage": "approved_artifact",
    "policy_ref_profile": "bundle_hash_present"
  },
  "evidence_refs": [
    {
      "id": "evidence-gateway-S2-diff",
      "type": "config_diff",
      "uri": "scenario://S2_configuration_change/evidence/config.diff"
    }
  ],
  "artifact_refs": [
    {
      "id": "artifact-gateway-S2-config",
      "type": "config_patch",
      "uri": "scenario://S2_configuration_change/artifacts/config.patch"
    }
  ],
  "approval_refs": [
    {
      "id": "approval-gateway-S2-self",
      "type": "SELF_APPROVAL",
      "uri": "scenario://S2_configuration_change/approvals/self.json"
    }
  ],
  "deployment_refs": []
}
