{
  "schema_version": "govreplay.agent_action_request.v1",
  "request_id": "req-s4-deployment-deny",
  "scenario_id": "S4_policy_gated_deployment",
  "workflow_id": "wf-gateway-s4-deployment-deny",
  "run_id": "run-gateway-fixture-001",
  "requested_at": "2026-07-04T16:31:00Z",
  "actor": {
    "actor_id": "govprov:actor:agent-deploy-001",
    "actor_type": "agent",
    "roles": ["AGENT_ROLE"]
  },
  "action": {
    "action_id": "action-gateway-S4-0002",
    "action_type": "deploy_artifact",
    "risk": "high"
  },
  "resource": {
    "resource_id": "deployment:payment-api:prod",
    "resource_type": "GovernedResource",
    "environment": "production"
  },
  "policy": {
    "bundle_ref": "software-delivery-p3-evidence-strengthened",
    "policy_version": "P3"
  },
  "policy_context": {
    "risk_tier": "high",
    "evidence_profile": "deployment_with_anchor",
    "approval_profile": "deploy_approver_distinct",
    "artifact_linkage": "unapproved_artifact",
    "policy_ref_profile": "bundle_hash_present"
  },
  "evidence_refs": [
    {
      "id": "evidence-gateway-S4-request",
      "type": "deployment_request",
      "uri": "scenario://S4_policy_gated_deployment/evidence/deployment.json"
    }
  ],
  "artifact_refs": [
    {
      "id": "artifact-gateway-S4-unapproved",
      "type": "container_image",
      "uri": "scenario://S4_policy_gated_deployment/artifacts/unapproved.image",
      "digest": {
        "algorithm": "sha256",
        "value": "0x3333333333333333333333333333333333333333333333333333333333333333"
      }
    }
  ],
  "approval_refs": [],
  "deployment_refs": [
    {
      "id": "deployment-gateway-S4-prod",
      "type": "production_deployment",
      "uri": "scenario://S4_policy_gated_deployment/deployments/prod.json"
    }
  ]
}
