{
  "schema_version": "govreplay.agent_action_request.v1",
  "request_id": "req-s5-governance-allow",
  "scenario_id": "S5_governance_state_change",
  "workflow_id": "wf-gateway-s5-governance-allow",
  "run_id": "run-gateway-fixture-001",
  "requested_at": "2026-07-04T16:40:00Z",
  "actor": {
    "actor_id": "govprov:actor:agent-governance-admin-001",
    "actor_type": "agent",
    "roles": ["GOVERNANCE_ADMIN"]
  },
  "action": {
    "action_id": "action-gateway-S5-0001",
    "action_type": "request_governance_state_change",
    "risk": "high"
  },
  "resource": {
    "resource_id": "policy:software-delivery-p3:activate",
    "resource_type": "GovernedResource",
    "environment": "governance"
  },
  "policy": {
    "bundle_ref": "software-delivery-p3-evidence-strengthened",
    "policy_version": "P3"
  },
  "policy_context": {
    "risk_tier": "high",
    "evidence_profile": "governance_change_request",
    "approval_profile": "governance_admin",
    "artifact_linkage": "contract_directory_update",
    "policy_ref_profile": "bundle_hash_present"
  },
  "evidence_refs": [
    {
      "id": "evidence-gateway-S5-change",
      "type": "governance_change_request",
      "uri": "scenario://S5_governance_state_change/evidence/change-request.json"
    }
  ],
  "artifact_refs": [],
  "approval_refs": [
    {
      "id": "approval-gateway-S5-admin",
      "type": "GOVERNANCE_ADMIN",
      "uri": "scenario://S5_governance_state_change/approvals/admin.json"
    }
  ],
  "deployment_refs": []
}
